{
  "schema_version": "x07.app.capabilities@0.1.0",
  "id": "caps_time_random_record",
  "v": 1,

  "fs": { "preopens": [] },
  "env": { "allow": [] },
  "secrets": { "allow": [] },

  "network": {
    "mode": "deny",
    "allowlist": []
  },

  "clocks": { "mode": "record" },
  "random": { "mode": "record" }
}
