{
  "schema_version": "x07.app.capabilities@0.1.0",
  "id": "caps_fs_ro",
  "v": 1,

  "fs": { "preopens": [{ "path": "spec/fixtures/phase6_caps_fs", "mode": "ro" }] },
  "env": { "allow": [] },
  "secrets": { "allow": [] },

  "network": {
    "mode": "deny",
    "allowlist": []
  },

  "clocks": { "mode": "deny" },
  "random": { "mode": "deny" }
}
